inn,name,revenue_year,revenue,segment_tag,source,okved_main,employees,site,description,region,contacts,rating_ref,okved_relevant
7719398064,Группа АДВ,2023,1200000000,COMM_GROUP,rrar_2025,73.11,350,https://www.adv-group.ru,"Крупнейшая коммуникационная группа в России, специализируется на BTL, PR, digital и event-маркетинге.",Москва,info@adv-group.ru,https://www.raso.ru/rating/btl/,True
7710700830,Eventum Premo,2023,850000000,BTL,rrar_2025,82.30,120,https://eventumpremo.ru,"Полный цикл организации мероприятий, активаций и промо-кампаний.",Москва,+7 (495) 120-08-08,https://www.raso.ru/rating/btl/,True
7719367940,iMARS Communications,2023,620000000,FULL_CYCLE,ruward,73.11,80,https://imars.ru,"Интегрированное агентство полного цикла: стратегия, креатив, медиа, аналитика.",Москва,hello@imars.ru,https://ruward.ru/winners/,True
7728916460,Deltaplan,2023,480000000,BTL,rrar_2025,73.11,200,https://deltaplan.ru,BTL-агентство с фокусом на активации бренда и мерчендайзинге.,Москва,info@deltaplan.ru,https://www.raso.ru/rating/btl/,True
7719297030,Подарки.ру,2023,320000000,SOUVENIR,list-org,46.49,150,https://podarki.ru,Производство и дистрибуция промо-сувениров и брендированной продукции.,Москва,sales@podarki.ru,,True
